{
  "$schema": "./interface-manifest.schema.json",
  "schemaVersion": "1.2.0",
  "globalAttributes": [
    {
      "name": "data-sds-root",
      "description": "Establishes SDS Lite theme tokens and color scheme without styling native elements.",
      "type": "boolean"
    },
    {
      "name": "data-sds-theme",
      "description": "Selects an SDS Lite theme.",
      "values": ["forge", "plaid"],
      "default": "forge"
    },
    {
      "name": "data-sds-color-scheme",
      "description": "Selects a light, dark, or system color scheme.",
      "values": ["light", "dark", "system"],
      "default": "light"
    },
    {
      "name": "data-sds-column-span",
      "description": "Lets a direct grid child span the full grid width.",
      "values": ["full"]
    },
    {
      "name": "data-sds-padding",
      "description": "Applies tokenized padding on every side.",
      "family": "space"
    },
    {
      "name": "data-sds-padding-block",
      "description": "Applies tokenized padding at the block start and end.",
      "family": "space"
    },
    {
      "name": "data-sds-padding-inline",
      "description": "Applies tokenized padding at the inline start and end.",
      "family": "space"
    },
    {
      "name": "data-sds-padding-block-start",
      "description": "Applies tokenized padding at the block start.",
      "family": "space"
    },
    {
      "name": "data-sds-padding-block-end",
      "description": "Applies tokenized padding at the block end.",
      "family": "space"
    },
    {
      "name": "data-sds-padding-inline-start",
      "description": "Applies tokenized padding at the inline start.",
      "family": "space"
    },
    {
      "name": "data-sds-padding-inline-end",
      "description": "Applies tokenized padding at the inline end.",
      "family": "space"
    },
    {
      "name": "data-sds-margin",
      "description": "Applies tokenized margin on every side.",
      "family": "space"
    },
    {
      "name": "data-sds-margin-block",
      "description": "Applies tokenized margin at the block start and end.",
      "family": "space"
    },
    {
      "name": "data-sds-margin-inline",
      "description": "Applies tokenized margin at the inline start and end.",
      "family": "space"
    },
    {
      "name": "data-sds-margin-block-start",
      "description": "Applies tokenized margin at the block start.",
      "family": "space"
    },
    {
      "name": "data-sds-margin-block-end",
      "description": "Applies tokenized margin at the block end.",
      "family": "space"
    },
    {
      "name": "data-sds-margin-inline-start",
      "description": "Applies tokenized margin at the inline start.",
      "family": "space"
    },
    {
      "name": "data-sds-margin-inline-end",
      "description": "Applies tokenized margin at the inline end.",
      "family": "space"
    }
  ],
  "optionFamilies": {
    "tone": {
      "nativeName": "data-sds-tone",
      "description": "Semantic color intent; info is blue and accent is purple.",
      "values": ["neutral", "accent", "info", "success", "warning", "danger"]
    },
    "size": {
      "nativeName": "data-sds-size",
      "description": "Visual scale.",
      "values": ["xs", "sm", "md", "lg", "xl", "2xl"]
    },
    "width": {
      "nativeName": "data-sds-width",
      "description": "Recipe or overlay width.",
      "values": ["auto", "sm", "md", "lg", "xl", "2xl"]
    },
    "orientation": {
      "nativeName": "data-sds-orientation",
      "description": "Layout or interaction orientation.",
      "values": ["horizontal", "vertical"]
    },
    "placement": {
      "description": "Preferred logical floating placement.",
      "values": [
        "block-start",
        "block-start-start",
        "block-start-end",
        "block-end",
        "block-end-start",
        "block-end-end",
        "inline-start",
        "inline-start-start",
        "inline-start-end",
        "inline-end",
        "inline-end-start",
        "inline-end-end"
      ]
    },
    "gap": {
      "nativeName": "data-sds-gap",
      "description": "Layout spacing.",
      "values": ["none", "xs", "sm", "md", "lg", "xl", "2xl", "3xl", "4xl"]
    },
    "space": {
      "description": "Tokenized margin or padding.",
      "values": ["none", "2xs", "xs", "sm", "md", "lg", "xl", "2xl", "3xl", "4xl"]
    }
  },
  "recipes": [
    {
      "name": "document",
      "category": "Layout and composition",
      "classes": ["sds-document"],
      "elements": ["body"],
      "description": "Opt-in standalone page typography, background, and margin reset.",
      "options": {}
    },
    {
      "name": "heading",
      "category": "Content and data display",
      "classes": ["sds-text-h1", "sds-text-h2", "sds-text-h3", "sds-text-h4", "sds-text-h5", "sds-text-h6"],
      "elements": ["h1", "h2", "h3", "h4", "h5", "h6"],
      "description": "Explicit SEI heading scale independent of semantic level, responsive at 48rem unless a fixed size is selected.",
      "options": {
        "data-sds-size": ["sm", "md", "lg"]
      },
      "defaults": {
        "data-sds-size": "md"
      }
    },
    {
      "name": "text",
      "category": "Content and data display",
      "classes": ["sds-text-lead", "sds-text-body", "sds-text-caption1", "sds-text-caption2"],
      "elements": ["p", "span", "div", "small", "figcaption"],
      "description": "Explicit SEI lead, body, and caption typography, responsive at 48rem unless a fixed size is selected.",
      "options": {
        "data-sds-size": ["sm", "md", "lg"]
      },
      "defaults": {
        "data-sds-size": "md"
      }
    },
    {
      "name": "fieldset",
      "category": "Actions and forms",
      "classes": ["sds-fieldset"],
      "elements": ["fieldset"],
      "description": "Explicit border and shape for a native fieldset.",
      "options": {}
    },
    {
      "name": "button",
      "category": "Actions and forms",
      "classes": ["sds-button"],
      "elements": ["button", "a"],
      "description": "Action styling for native buttons and links.",
      "options": {
        "data-sds-variant": ["filled", "tonal", "outlined", "text"],
        "data-sds-tone": ["neutral", "accent", "info", "success", "warning", "danger"],
        "data-sds-size": ["xs", "sm", "md", "lg", "xl"],
        "data-sds-density": ["compact"],
        "data-sds-shape": ["icon"],
        "data-sds-block": []
      },
      "omissionDefaults": {
        "data-sds-variant": "filled for text buttons; text for icon buttons",
        "data-sds-density": "comfortable",
        "data-sds-shape": "text"
      },
      "defaults": {
        "data-sds-variant": "filled for text buttons; text for icon buttons",
        "data-sds-tone": "info",
        "data-sds-size": "md",
        "data-sds-density": "comfortable",
        "data-sds-shape": "text",
        "data-sds-block": false
      }
    },
    {
      "name": "link",
      "category": "Actions and forms",
      "classes": ["sds-link"],
      "elements": ["a"],
      "description": "Link styling with semantic tone and emphasis.",
      "options": {
        "data-sds-variant": ["secondary", "tertiary", "inline", "cta"],
        "data-sds-tone": ["neutral", "accent", "info", "success", "warning", "danger"],
        "data-sds-size": ["xs", "sm", "md", "lg", "xl"]
      },
      "omissionDefaults": {"data-sds-variant": "primary", "data-sds-size": "inherited"},
      "defaults": {
        "data-sds-variant": "primary",
        "data-sds-tone": "info",
        "data-sds-size": "inherited"
      }
    },
    {
      "name": "field",
      "category": "Actions and forms",
      "classes": ["sds-field"],
      "description": "Label, control, help, and validation layout.",
      "options": {
        "data-sds-orientation": ["horizontal", "vertical"],
        "data-sds-tone": ["neutral", "accent", "info", "success", "warning", "danger"]
      },
      "optionTargets": {
        "data-sds-tone": ".sds-field > small, .sds-field > label small"
      },
      "omissionDefaults": {"data-sds-tone": "muted help; inherited label color"},
      "defaults": {
        "data-sds-orientation": "vertical",
        "data-sds-tone": "muted help; inherited label color"
      }
    },
    {
      "name": "form",
      "category": "Actions and forms",
      "classes": ["sds-form"],
      "description": "Narrow vertical form layout.",
      "options": {}
    },
    {
      "name": "form-control",
      "category": "Actions and forms",
      "classes": ["sds-input", "sds-select"],
      "elements": ["input", "select", "textarea"],
      "description": "Explicit hooks for native form controls.",
      "options": {
        "data-sds-size": ["sm", "md", "lg"]
      },
      "defaults": {
        "data-sds-size": "md"
      }
    },
    {
      "name": "input-group",
      "category": "Actions and forms",
      "classes": ["sds-input-group", "sds-input-addon"],
      "description": "Native form control with a visible prefix or suffix.",
      "options": {
        "data-sds-size": ["sm", "md", "lg"]
      },
      "defaults": {
        "data-sds-size": "md"
      }
    },
    {
      "name": "range",
      "category": "Actions and forms",
      "classes": ["sds-range"],
      "elements": ["input"],
      "description": "Native range input styling.",
      "options": {
        "data-sds-tone": ["neutral", "accent", "info", "success", "warning", "danger"],
        "data-sds-size": ["sm", "md", "lg"]
      },
      "defaults": {
        "data-sds-tone": "info",
        "data-sds-size": "md"
      }
    },
    {
      "name": "combobox-parts",
      "category": "Actions and forms",
      "classes": ["sds-combobox-list"],
      "description": "Suggestion list for a native text input.",
      "options": {
        "data-sds-value": []
      },
      "optionTypes": {
        "data-sds-value": "string"
      },
      "optionTargets": {
        "data-sds-value": ".sds-combobox-list > li"
      },